<?xml version="1.0" encoding="UTF-8"?>
<bankHierarchy xmlns:xsi="http://www.w3.org/2001/XMLSchema-instance"
               xsi:noNamespaceSchemaLocation="bankHierarchy.xsd">
    <bankEntity>
        <name>Bank A</name>
        <branches>
            <branch>
                <name>Branch 1</name>
                <employees>
                    <employee>
                        <name>John Doe</name>
                    </employee>
                    <employee>
                        <name>Jane Smith</name>
                    </employee>
                </employees>
                <customers>
                    <customer>
                        <name>David Johnson</name>
                        <accounts>
                            <accountEntity>
                                <type>Savings</type>
                                <balance>5000</balance>
                            </accountEntity>
                            <accountEntity>
                                <type>Checking</type>
                                <balance>2000</balance>
                            </accountEntity>
                        </accounts>
                    </customer>
                </customers>
            </branch>
            <branch>
                <name>Branch 2</name>
                <employees>
                    <employee>
                        <name>Robert Brown</name>
                    </employee>
                </employees>
                <customers>
                    <customer>
                        <name>Michael Davis</name>
                        <accounts>
                            <accountEntity>
                                <type>Savings</type>
                                <balance>10000</balance>
                            </accountEntity>
                        </accounts>
                    </customer>
                    <customer>
                        <name>Lisa Wilson</name>
                        <accounts>
                            <accountEntity>
                                <type>Checking</type>
                                <balance>5000</balance>
                            </accountEntity>
                        </accounts>
                    </customer>
                </customers>
            </branch>
        </branches>
    </bankEntity>
</bankHierarchy>